id,name_en,name_vi,scope,age_range,location,deadline,prize,website,description_en,description_vi
regeneron_sts_2026,Regeneron Science Talent Search 2026,Cuộc thi Tìm kiếm Tài năng Khoa học Regeneron 2026,National (USA),US high‑school seniors,"Washington, DC, USA",2025-11-06 20:00 ET,"$250,000 top award",https://www.societyforscience.org/regeneron-sts/,Prestigious US science research competition for high‑school seniors.,Cuộc thi nghiên cứu khoa học uy tín dành cho học sinh lớp 12 tại Hoa Kỳ.
breakthrough_jc_2025,Breakthrough Junior Challenge 2025,Thử thách Breakthrough Junior 2025,International,13‑18,Online (global),2025-09-15 23:59 PDT,"$250,000 scholarship + teacher & school prizes",https://breakthroughjuniorchallenge.org/,Global video contest where students explain a scientific concept creatively.,Cuộc thi video toàn cầu yêu cầu học sinh giải thích khái niệm khoa học một cách sáng tạo.
nasa_space_apps_2025,NASA Space Apps Challenge 2025,Thử thách NASA Space Apps 2025,International,16+ (varies),Global hackathons (physical & virtual),2025-10-04,Invitation to NASA launch & swag,https://spaceappschallenge.org/,72‑hour hackathon solving space and Earth science challenges.,Hackathon 72 giờ giải quyết các thách thức khoa học vũ trụ và Trái Đất.
frc_2026,FIRST Robotics Competition 2026 Season,Cuộc thi Robot FIRST 2026,International,14‑18 (high‑school),Worldwide regional events,2026-01-10 12:00 ET,Scholarships & awards,https://www.firstinspires.org/,Team‑based robotics build and competition season kicking off Jan 10 2026.,Mùa giải robot đồng đội chính thức khởi động ngày 10/01/2026.
isef_2026,Regeneron International Science and Engineering Fair 2026,Hội chợ KH&KT Quốc tế Regeneron 2026,International,High‑school researchers (via affiliated fairs),"Phoenix, Arizona, USA",2026-05-09,Over $5 million in awards,https://www.societyforscience.org/isef/,World’s largest pre‑college science research competition.,Cuộc thi nghiên cứu khoa học lớn nhất thế giới dành cho học sinh trung học.
iypt_2026,International Young Physicists’ Tournament 2026,Giải Vật lý trẻ Quốc tế IYPT 2026,International,High‑school teams,"Zurich, Switzerland",2026-07-05,Medals & certificates,https://iypt.org/,Team‑based physics research and debate competition.,Cuộc thi nghiên cứu và tranh biện vật lý dành cho đội học sinh THPT.
gsoc_2025,Google Summer of Code 2025,Google Summer of Code 2025,International,18+,Online,2025-04-08,Paid open‑source stipends,https://summerofcode.withgoogle.com/,Paid open‑source coding program.,Chương trình lập trình mã nguồn mở có trả thưởng.
imagine_cup_2025,Microsoft Imagine Cup 2025,Microsoft Imagine Cup 2025,International,16+,Online & global finals,2025-01-22,"$100,000 & mentorship",https://imaginecup.microsoft.com/,Student innovation competition for tech solutions.,Cuộc thi sáng tạo công nghệ dành cho sinh viên.
